{
  "id": "claude-sonnet-4.5/FG-0001/a0",
  "question_id": "FG-0001",
  "template": "boxed_warning",
  "variant": "",
  "teacher_model": "openrouter/anthropic/claude-sonnet-4.5",
  "attempt_index": 0,
  "prompt_version": "v4",
  "tool_budget": 8,
  "messages": [
    {
      "role": "system",
      "content": "You are an FDA-Gym agent. Answer only from tool outputs returned in THIS episode.\nDo not use memorized FDA facts. If a tool result does not contain the answer, call another tool or submit NOT_FOUND.\n\nCall submit_answer when you are done. Its arguments must match schemas/answer.schema.json:\n  {\"answer\": <string|number|boolean>, \"citations\": [{\"endpoint\": \"...\", \"id\": \"...\", \"field\": \"...\", \"quote\": \"...\"}]}\n- endpoint is one of drug/label, drug/event, drug/drugsfda.\n- id is a set_id, application_number, or \"step:<n>\" for FAERS aggregates and empty searches (n is the tool-call index that returned them).\n- field is a path the tool actually returned: boxed_warning, sections, submissions, products, sponsor_name, results, meta.results.total, ...\n- search_approvals accepts application_number (NDA020977, NDA 020977, 020977, or a BLA/ANDA number) as well as generic_name. Use the application number when the question names one.\n- search_approvals returns one page (page starts at 1). NDA and BLA rows come before ANDA, and submissions list only the original approval.\n- quote is copied from that field in THIS episode's tool output (verbatim span, not a paraphrase). Quotes shorter than 4 characters never count.\n- MedDRA reaction terms are uppercase with British spelling; copy the term from results, do not translate it.\n- A missing boxed warning is cited from search_drug_label: id = the label's set_id, field = sections.\n- NOT_FOUND is only correct when the snapshot has no record, and only after you searched.\n- query_adverse_events requires generic_name and mode. mode is top_reactions or count. top_reactions returns at most 10 MedDRA terms (each term and count) in results, under id step:<n>. count returns how many reports match in meta.results.total and leaves results empty, under the same id. serious may only be true; omit it for all reports. year, when set, must be from 2020 through 2025. serious and year filter both modes.\n- You get at most 8 tool calls, then you must submit_answer."
    },
    {
      "role": "user",
      "content": "Does the FDA label for warfarin carry a boxed warning, and if so, about what risk?"
    },
    {
      "role": "assistant",
      "content": "<tool_call>\n{\"name\": \"search_drug_label\", \"arguments\": {\"generic_name\": \"warfarin\"}}\n</tool_call>"
    },
    {
      "role": "tool",
      "name": "search_drug_label",
      "content": "{\"tool\": \"search_drug_label\", \"output\": {\"id\": \"step:1\", \"results\": [{\"set_id\": \"0cbce382-9c88-4f58-ae0f-532a841e8f95\", \"brand\": \"Warfarin Sodium\", \"manufacturer\": \"Teva Pharmaceuticals USA, Inc.\", \"effective_time\": \"20250617\", \"sections\": [\"boxed_warning\", \"indications_and_usage\", \"contraindications\", \"warnings_and_cautions\", \"adverse_reactions\", \"drug_interactions\", \"pregnancy\", \"overdosage\", \"description\"]}, {\"set_id\": \"1244c338-9140-425a-bf2a-9da6b4ac0287\", \"brand\": \"Warfarin Sodium\", \"manufacturer\": \"REMEDYREPACK INC.\", \"effective_time\": \"20260624\", \"sections\": [\"boxed_warning\", \"indications_and_usage\", \"contraindications\", \"warnings_and_cautions\", \"adverse_reactions\", \"drug_interactions\", \"pregnancy\", \"overdosage\", \"description\"]}, {\"set_id\": \"19a69a72-ac5d-45d5-a94d-a5aaecbe4730\", \"brand\": \"Jantoven\", \"manufacturer\": \"Upsher-Smith Laboratories, LLC\", \"effective_time\": \"20250708\", \"sections\": [\"boxed_warning\", \"indications_and_usage\", \"contraindications\", \"warnings_and_cautions\", \"adverse_reactions\", \"drug_interactions\", \"pregnancy\", \"overdosage\", \"description\"]}, {\"set_id\": \"21255cd5-3c2e-4574-9620-9347d14256b3\", \"brand\": \"Warfarin Sodium\", \"manufacturer\": \"PD-Rx Pharmaceuticals, Inc.\", \"effective_time\": \"20250715\", \"sections\": [\"boxed_warning\", \"indications_and_usage\", \"contraindications\", \"warnings_and_cautions\", \"adverse_reactions\", \"drug_interactions\", \"pregnancy\", \"overdosage\", \"description\"]}, {\"set_id\": \"2c8f47c6-a180-4ad8-b962-04069d2270cb\", \"brand\": \"Warfarin Sodium\", \"manufacturer\": \"Aphena Pharma Solutions - Tennessee, LLC\", \"effective_time\": \"20210729\", \"sections\": [\"boxed_warning\", \"indications_and_usage\", \"contraindications\", \"warnings_and_cautions\", \"adverse_reactions\", \"drug_interactions\", \"pregnancy\", \"overdosage\", \"description\"]}], \"meta\": {\"results\": {\"total\": 74, \"page\": 1, \"page_size\": 10}}}, \"error\": null, \"tool_calls_remaining\": 7}"
    },
    {
      "role": "assistant",
      "content": "<tool_call>\n{\"name\": \"get_label_section\", \"arguments\": {\"set_id\": \"0cbce382-9c88-4f58-ae0f-532a841e8f95\", \"section\": \"boxed_warning\"}}\n</tool_call>"
    },
    {
      "role": "tool",
      "name": "get_label_section",
      "content": "{\"tool\": \"get_label_section\", \"output\": {\"set_id\": \"0cbce382-9c88-4f58-ae0f-532a841e8f95\", \"boxed_warning\": \"WARNING: BLEEDING RISK Warfarin sodium can cause major or fatal bleeding [see Warnings and Precautions ( 5.1 )] . Perform regular monitoring of INR in all treated patients [see Dosage and Administration ( 2.1 )] . Drugs, dietary changes, and other factors affect INR levels achieved with warfarin sodium therapy [see Drug Interactions ( 7 )] . Instruct patients about prevention measures to minimize risk of bleeding and to report signs and symptoms of bleeding [see Patient Counseling Information ( 17 )] . WARNING: BLEEDING RISK See full prescribing information for complete boxed warning. Warfarin sodium can cause major or fatal bleeding. ( 5.1 ) Perform regular monitoring of INR in all treated patients. ( 2.1 ) Drugs, dietary changes, and other factors affect INR levels achieved with warfarin sodium therapy. ( 7 ) Instruct patients about prevention measures to minimize risk of bleeding and to report signs and symptoms of bleeding. ( 17 )\"}, \"error\": null, \"tool_calls_remaining\": 6}"
    },
    {
      "role": "assistant",
      "content": "<tool_call>\n{\"name\": \"submit_answer\", \"arguments\": {\"answer\": \"Yes. bleeding.\", \"citations\": [{\"endpoint\": \"drug/label\", \"id\": \"0cbce382-9c88-4f58-ae0f-532a841e8f95\", \"field\": \"boxed_warning\", \"quote\": \"WARNING: BLEEDING RI\"}]}}\n</tool_call>"
    }
  ],
  "reward": {
    "total": 1.0,
    "correctness": 1.0,
    "citation": 1.0,
    "format": 1.0,
    "efficiency": 1.0,
    "citations_valid": 1,
    "citations_total": 1,
    "notes": [
      "format: answer matches the schema",
      "citation 1/1 valid",
      "valid: 0cbce382-9c88-4f58-ae0f-532a841e8f95 boxed_warning (quote fuzzy 1.00)",
      "boolean: polarity and keyword match",
      "efficiency 1.00: min_tool_calls 2 over 2 tool calls",
      "total 1.0000 = 0.60*1.0000 + 0.25*1.0000 + 0.10*1.0000 + 0.05*1.0000"
    ]
  },
  "passed": true
}
